{
  "$schema": "https://json-schema.org/draft/2020-12/schema",
  "$id": "https://github.com/Quirk-Systems/.github/blob/main/.quirk/schemas/portfolio-registry.schema.json",
  "title": "Quirk portfolio registry",
  "description": "The .quirk/repositories.json contract: owner-classified repositories plus an observed-only inventory of repositories that exist but have no approved classification. Observation never implies purpose, lifecycle, authority, or canon.",
  "type": "object",
  "additionalProperties": false,
  "required": ["registry_version", "authority", "updated_at", "status", "repositories", "unclassified_policy"],
  "properties": {
    "registry_version": {"type": "string", "pattern": "^\\d+\\.\\d+\\.\\d+(?:-[a-z0-9.-]+)?$"},
    "authority": {"const": "Quirk-Systems/.github"},
    "updated_at": {"type": "string", "pattern": "^\\d{4}-\\d{2}-\\d{2}$"},
    "status": {"type": "string", "minLength": 1},
    "repositories": {
      "type": "array",
      "minItems": 1,
      "items": {
        "type": "object",
        "additionalProperties": false,
        "required": ["repository", "visibility", "primary_class", "lifecycle", "canonical", "purpose"],
        "properties": {
          "repository": {"type": "string", "pattern": "^Quirk-Systems/[A-Za-z0-9_.-]+$"},
          "visibility": {"enum": ["public", "private"]},
          "primary_class": {
            "enum": ["canon", "kernel", "registry", "interface", "connector", "instrument", "realm", "reference", "lab", "sandbox"]
          },
          "lifecycle": {
            "enum": ["proposed", "incubating", "active", "maintained", "frozen", "deprecated", "archived", "reserved", "proposed_archive"]
          },
          "canonical": {"type": "boolean"},
          "purpose": {"type": "string", "minLength": 1},
          "topology_status": {"type": "string", "minLength": 1},
          "classification_status": {"type": "string", "minLength": 1},
          "historical_note": {"type": "string", "minLength": 1},
          "authority_boundary": {"type": "string", "minLength": 1},
          "extraction_trigger": {"type": "string", "minLength": 1},
          "retirement_condition": {"type": "string", "minLength": 1}
        }
      }
    },
    "unclassified_policy": {"type": "string", "minLength": 1},
    "observation": {
      "type": "object",
      "additionalProperties": false,
      "required": ["observed_at", "source", "total_observed", "registered_not_observed"],
      "properties": {
        "observed_at": {"type": "string", "pattern": "^\\d{4}-\\d{2}-\\d{2}$"},
        "source": {"type": "string", "minLength": 1},
        "total_observed": {"type": "integer", "minimum": 0},
        "registered_not_observed": {
          "type": "array",
          "uniqueItems": true,
          "items": {"type": "string", "pattern": "^Quirk-Systems/[A-Za-z0-9_.-]+$"}
        }
      }
    },
    "observed_unclassified": {
      "type": "array",
      "items": {
        "type": "object",
        "additionalProperties": false,
        "required": ["repository", "visibility", "created_at", "observed_at", "status"],
        "properties": {
          "repository": {"type": "string", "pattern": "^Quirk-Systems/[A-Za-z0-9_.-]+$"},
          "visibility": {"enum": ["public", "private"]},
          "created_at": {"type": "string", "pattern": "^\\d{4}-\\d{2}-\\d{2}T\\d{2}:\\d{2}:\\d{2}Z$"},
          "observed_at": {"type": "string", "pattern": "^\\d{4}-\\d{2}-\\d{2}$"},
          "status": {"const": "OBSERVED_UNCLASSIFIED"},
          "observed_language": {"type": ["string", "null"], "minLength": 1},
          "observed_description": {"type": ["string", "null"], "minLength": 1}
        }
      }
    }
  }
}
