{
  "registry_version": "0.1.1-candidate",
  "authority": "Quirk-Systems/.github",
  "updated_at": "2026-08-28",
  "status": "candidate_truth_repair_pending_independent_merge_gate",
  "repositories": [
    {
      "repository": "Quirk-Systems/.github",
      "visibility": "public",
      "primary_class": "canon",
      "lifecycle": "active",
      "canonical": true,
      "purpose": "Public organization governance, semantic authority, repository contracts, portfolio truth, and reusable workflows"
    },
    {
      "repository": "Quirk-Systems/.github-private",
      "visibility": "private",
      "primary_class": "canon",
      "lifecycle": "active",
      "canonical": true,
      "purpose": "Internal policy, sensitive organization templates, and private operational governance"
    },
    {
      "repository": "Quirk-Systems/project-scaffold",
      "visibility": "public",
      "primary_class": "kernel",
      "lifecycle": "active",
      "canonical": true,
      "purpose": "Implemented Quirk kernel/operator codebase retained as a distinct current repository",
      "topology_status": "REQUIRES_OWNER_DECISION",
      "historical_note": "Earlier strategy proposed renaming this repository to quirk-os; current observed topology contains both repositories and does not prove that cutover occurred."
    },
    {
      "repository": "Quirk-Systems/quirk-os",
      "visibility": "public",
      "primary_class": "kernel",
      "lifecycle": "active",
      "canonical": false,
      "purpose": "Candidate Quirk OS runtime, Skill runtime/projection architecture, and bounded system candidates",
      "topology_status": "ACTIVE_OBSERVED_REQUIRES_OWNER_RECONCILIATION",
      "historical_note": "This repository is no longer accurately described as a private empty placeholder."
    },
    {
      "repository": "Quirk-Systems/quirk-core",
      "visibility": "public",
      "primary_class": "canon",
      "lifecycle": "active",
      "canonical": false,
      "purpose": "Shared Quirk contracts, governance documentation, schemas, validators, and canonical-candidate definitions",
      "classification_status": "PROPOSED_PENDING_REVIEW"
    },
    {
      "repository": "Quirk-Systems/quirk-skills",
      "visibility": "private",
      "primary_class": "instrument",
      "lifecycle": "incubating",
      "canonical": false,
      "purpose": "Portable Quirk Skill candidate source packages and attributable package-local evaluation evidence",
      "authority_boundary": "Candidate source only; no admission, activation, runtime, canon, deployment, or publication authority",
      "classification_status": "PROPOSED_PENDING_REVIEW"
    },
    {
      "repository": "Quirk-Systems/quirk-data",
      "visibility": "private",
      "primary_class": "registry",
      "lifecycle": "reserved",
      "canonical": false,
      "purpose": "Potential persistent world-state, evidence, provenance, graph, and data projection boundary",
      "extraction_trigger": "A second independent consumer, separate security boundary, or independent release/runtime requirement"
    },
    {
      "repository": "Quirk-Systems/quirk-me",
      "visibility": "private",
      "primary_class": "interface",
      "lifecycle": "reserved",
      "canonical": false,
      "purpose": "Potential identity, preference, consent, memory, and human-authority boundary",
      "extraction_trigger": "Independent product surface, privacy boundary, or second consumer of identity and preference contracts"
    },
    {
      "repository": "Quirk-Systems/quirk-run",
      "visibility": "private",
      "primary_class": "kernel",
      "lifecycle": "reserved",
      "canonical": false,
      "purpose": "Potential execution, containment, durable workflow, receipt, retry, and agent-run boundary",
      "extraction_trigger": "Workers, CLI, scheduled agents, or another runtime become real independent consumers"
    },
    {
      "repository": "Quirk-Systems/quirk-feed",
      "visibility": "public",
      "primary_class": "interface",
      "lifecycle": "active",
      "canonical": false,
      "purpose": "Preparation, ingestion, discovery, source taxonomy, research registry, and derived-knowledge surface"
    },
    {
      "repository": "Quirk-Systems/quirk-generator",
      "visibility": "public",
      "primary_class": "instrument",
      "lifecycle": "active",
      "canonical": false,
      "purpose": "Bounded multi-model visual-generation instrument"
    },
    {
      "repository": "Quirk-Systems/quirk-beauty",
      "visibility": "private",
      "primary_class": "realm",
      "lifecycle": "incubating",
      "canonical": false,
      "purpose": "Realm proof for deterministic aesthetic interpretation and persisted palette generation",
      "retirement_condition": "Archive or merge patterns back into Quirk OS after reusable contracts are extracted"
    },
    {
      "repository": "Quirk-Systems/quirk-pet",
      "visibility": "private",
      "primary_class": "realm",
      "lifecycle": "incubating",
      "canonical": false,
      "purpose": "Realm proof for persistent state, time decay, bounded actions, consequences, and derived mood",
      "retirement_condition": "Archive or convert to a maintained reference after state-machine patterns are captured"
    },
    {
      "repository": "Quirk-Systems/quirk-town",
      "visibility": "private",
      "primary_class": "realm",
      "lifecycle": "incubating",
      "canonical": false,
      "purpose": "Realm proof for directory identity, residency, listings, and claimable space",
      "retirement_condition": "Archive or evolve only after a real Quirk ecosystem directory requirement is validated"
    },
    {
      "repository": "Quirk-Systems/demo-repository",
      "visibility": "private",
      "primary_class": "sandbox",
      "lifecycle": "proposed_archive",
      "canonical": false,
      "purpose": "GitHub feature demonstration and disposable workflow testing",
      "retirement_condition": "Archive when no unique GitHub feature test depends on it"
    }
  ],
  "unclassified_policy": "Repositories observed outside this registry remain OBSERVED_UNCLASSIFIED until an owner-approved classification is merged. Existence or naming alone does not establish purpose, lifecycle, authority, or canon.",
  "observation": {
    "observed_at": "2026-09-19",
    "source": "GitHub repository search `org:Quirk-Systems` (49 results, incomplete_results=false)",
    "total_observed": 49,
    "registered_not_observed": [
      "Quirk-Systems/demo-repository"
    ]
  },
  "observed_unclassified": [
    {
      "repository": "Quirk-Systems/Quirk",
      "visibility": "private",
      "created_at": "2026-07-29T14:25:58Z",
      "observed_at": "2026-09-19",
      "status": "OBSERVED_UNCLASSIFIED",
      "observed_language": "HTML",
      "observed_description": "Quirkverse monorepo — skills, pipeline, creative, vault"
    },
    {
      "repository": "Quirk-Systems/quirk-agents",
      "visibility": "private",
      "created_at": "2026-08-21T16:45:46Z",
      "observed_at": "2026-09-19",
      "status": "OBSERVED_UNCLASSIFIED",
      "observed_language": null,
      "observed_description": null
    },
    {
      "repository": "Quirk-Systems/quirk-arcade",
      "visibility": "private",
      "created_at": "2026-08-21T16:48:27Z",
      "observed_at": "2026-09-19",
      "status": "OBSERVED_UNCLASSIFIED",
      "observed_language": null,
      "observed_description": null
    },
    {
      "repository": "Quirk-Systems/quirk-arena",
      "visibility": "private",
      "created_at": "2026-08-21T17:30:49Z",
      "observed_at": "2026-09-19",
      "status": "OBSERVED_UNCLASSIFIED",
      "observed_language": null,
      "observed_description": null
    },
    {
      "repository": "Quirk-Systems/quirk-art",
      "visibility": "private",
      "created_at": "2026-08-21T16:20:18Z",
      "observed_at": "2026-09-19",
      "status": "OBSERVED_UNCLASSIFIED",
      "observed_language": null,
      "observed_description": null
    },
    {
      "repository": "Quirk-Systems/quirk-bio",
      "visibility": "private",
      "created_at": "2026-08-21T16:41:59Z",
      "observed_at": "2026-09-19",
      "status": "OBSERVED_UNCLASSIFIED",
      "observed_language": null,
      "observed_description": null
    },
    {
      "repository": "Quirk-Systems/quirk-city",
      "visibility": "private",
      "created_at": "2026-08-21T16:37:44Z",
      "observed_at": "2026-09-19",
      "status": "OBSERVED_UNCLASSIFIED",
      "observed_language": null,
      "observed_description": null
    },
    {
      "repository": "Quirk-Systems/quirk-club",
      "visibility": "private",
      "created_at": "2026-08-21T16:49:33Z",
      "observed_at": "2026-09-19",
      "status": "OBSERVED_UNCLASSIFIED",
      "observed_language": null,
      "observed_description": null
    },
    {
      "repository": "Quirk-Systems/quirk-code",
      "visibility": "private",
      "created_at": "2026-08-21T16:41:37Z",
      "observed_at": "2026-09-19",
      "status": "OBSERVED_UNCLASSIFIED",
      "observed_language": null,
      "observed_description": null
    },
    {
      "repository": "Quirk-Systems/quirk-design",
      "visibility": "private",
      "created_at": "2026-08-21T17:29:37Z",
      "observed_at": "2026-09-19",
      "status": "OBSERVED_UNCLASSIFIED",
      "observed_language": null,
      "observed_description": null
    },
    {
      "repository": "Quirk-Systems/quirk-directory",
      "visibility": "private",
      "created_at": "2026-08-21T17:30:22Z",
      "observed_at": "2026-09-19",
      "status": "OBSERVED_UNCLASSIFIED",
      "observed_language": null,
      "observed_description": null
    },
    {
      "repository": "Quirk-Systems/quirk-dog",
      "visibility": "private",
      "created_at": "2026-08-11T10:28:32Z",
      "observed_at": "2026-09-19",
      "status": "OBSERVED_UNCLASSIFIED",
      "observed_language": null,
      "observed_description": null